{
  "planId": "ai-knowledge-base-content-improvement-2026-08",
  "stageId": "stage-0",
  "generatedAt": "2026-08-05",
  "canonicalStatus": "draft",
  "note": "结构与引用已复核；输入覆盖账仍有 pending 项，C-N01～C-N10 尚未完成逐题当前位置核验，因此 Stage 0 保持 incomplete/draft，不作为全量 screening 已完成的证据。",
  "baseline": {
    "currentCommit": "671072cae7bb3ffcde366713eb421e65c2e9cbc1",
    "targetCommit": "100ca761fec3e55ceea01609d01f66b0c05802dc",
    "coverageLedgerHash": "见 source-coverage.json（1.0-file-level）"
  },
  "candidates": [
    {
      "candidateId": "C-001",
      "conceptKey": "field-core-question-set",
      "candidateKind": "delivery-method",
      "candidateCategories": [
        "学习路径或现场取用方式",
        "客户问题或客户口语"
      ],
      "sourceOccurrenceIds": [
        "O-P-D1",
        "O-P-F1",
        "O-P-G1",
        "O-P-H4"
      ],
      "summary": "对照库用『实战包 91 题 + 必背 24 题 + 10 分钟速刷/40 分钟通刷』组织对客交锋，每题 15–30 秒电梯版且带一个可复述判据与回源深潜锚点。当前库有 320 道正式问答但没有现场核心精选与时间预算入口。",
      "coverageStatus": "net-new",
      "currentLocations": [],
      "deltaSummary": "现场核心题精选层（必背集、时间预算、电梯版取用）整体缺失；正式答案本体不需要复制。",
      "decisionImpactSummary": "售前人员会前/现场取用效率与一致性显著提升，避免现场凭记忆答。",
      "dynamicity": "stable",
      "evidenceGate": "pass",
      "riskLevel": "low",
      "ownerType": "global",
      "ownerId": "questions-directory",
      "recommendedAction": "absorb",
      "actionReason": "与计划第 1 阶段目标直接对应，全部基于现有正式问答即可实现，不新增事实。",
      "reviewGroup": "G1 现场备战层",
      "recommendedStage": "stage-1",
      "priority": "P0",
      "englishImpact": "none",
      "localeRequirement": "none",
      "dateImpact": "none",
      "reviewDecision": "approved",
      "decidedAt": "2026-08-05",
      "finalAction": "implement",
      "executionReadiness": "ready",
      "localeGate": "pass",
      "localeGateReceipt": "receipt-contract07-2026-08-05",
      "noMatchSearch": "已检查当前库相关模块与全局层的正式问答、证据卡、深挖、课程与学习入口，未发现等价覆盖；无匹配依据：现场核心题精选层（必背集、时间预算、电梯版取用）整体缺失；正式答案本体不需要复制。",
      "decisionNotes": "Stage 1 落地：现场核心题精选层（field-kit 8 意图、30 现场题）。；localeGate 依据 07 契约（对应模块 deferment 已登记）。",
      "ownerStatus": "resolved",
      "targetStage": "stage-1",
      "targetBatch": "stage-1",
      "recommendedBatch": "stage-1"
    },
    {
      "candidateId": "C-002",
      "conceptKey": "fallback-scripts",
      "candidateKind": "delivery-method",
      "candidateCategories": [
        "售前交付与验收方法",
        "客户问题或客户口语"
      ],
      "sourceOccurrenceIds": [
        "O-FB-1",
        "O-FB-2",
        "O-FB-3",
        "O-FB-4"
      ],
      "summary": "四类兜底话术：被问没听过的名词、被要求承诺数字、被质疑数字来源、被问『我们已经有 X 了』。当前库无系统化兜底话术。",
      "coverageStatus": "net-new",
      "currentLocations": [],
      "deltaSummary": "计划 Stage 1 已列出同类四类兜底（信息不足/动态事实/法律安全/业务状态未知），本候选为对照库表达的具体触发与话术样本，可并入 Stage 1 设计。",
      "decisionImpactSummary": "现场遇到信息不足或数字压力时给出一致、不越界的回答边界。",
      "dynamicity": "stable",
      "evidenceGate": "pass",
      "riskLevel": "low",
      "ownerType": "global",
      "ownerId": "questions-directory",
      "recommendedAction": "absorb",
      "actionReason": "纯取用层方法，不改变事实与边界，可直接纳入 Stage 1 兜底话术设计。",
      "reviewGroup": "G1 现场备战层",
      "recommendedStage": "stage-1",
      "priority": "P0",
      "englishImpact": "none",
      "localeRequirement": "none",
      "dateImpact": "none",
      "reviewDecision": "approved",
      "decidedAt": "2026-08-05",
      "finalAction": "implement",
      "executionReadiness": "ready",
      "localeGate": "pass",
      "localeGateReceipt": "receipt-contract07-2026-08-05",
      "noMatchSearch": "已检查当前库相关模块与全局层的正式问答、证据卡、深挖、课程与学习入口，未发现等价覆盖；无匹配依据：计划 Stage 1 已列出同类四类兜底（信息不足/动态事实/法律安全/业务状态未知），本候选为对照库表达的具体触发与话术样本，可并入 Stage 1 设计。",
      "decisionNotes": "Stage 1 落地：四类兜底话术（fallbackScripts）。；localeGate 依据 07 契约（对应模块 deferment 已登记）。",
      "ownerStatus": "resolved",
      "targetStage": "stage-1",
      "targetBatch": "stage-1",
      "recommendedBatch": "stage-1"
    },
    {
      "candidateId": "C-003",
      "conceptKey": "time-budget-learning-paths",
      "candidateKind": "delivery-method",
      "candidateCategories": [
        "学习路径或现场取用方式"
      ],
      "sourceOccurrenceIds": [
        "O-LP-01",
        "O-LP-02",
        "O-LP-03",
        "O-LP-04",
        "O-LP-05",
        "O-LP-06",
        "O-LP-07",
        "O-LP-08",
        "O-LP-09",
        "O-LP-10",
        "O-LP-11",
        "O-LP-12",
        "O-LP-13",
        "O-LP-14",
        "O-LP-15",
        "O-LP-16",
        "O-LP-17",
        "O-LP-18",
        "O-1P-01",
        "O-1P-02",
        "O-1P-03",
        "O-1P-04",
        "O-1P-05",
        "O-1P-06",
        "O-1P-07",
        "O-1P-08",
        "O-1P-09",
        "O-1P-10",
        "O-1P-11",
        "O-1P-12",
        "O-1P-13",
        "O-1P-14"
      ],
      "summary": "按可用时间组织的学习入口（10 分钟速查、30 分钟会前、2 小时备战、系统学习），每个入口有明确产出物。当前库首页只有按客户场景的四条路径，无时间预算路径。",
      "coverageStatus": "net-new",
      "currentLocations": [],
      "deltaSummary": "时间预算路径与每步可观察交付物为净新增；场景路径可保留并与之并存。",
      "decisionImpactSummary": "不同准备时间的人都能找到对应入口并产出可交付物。",
      "dynamicity": "stable",
      "evidenceGate": "pass",
      "riskLevel": "low",
      "ownerType": "global",
      "ownerId": "questions-directory",
      "recommendedAction": "absorb",
      "actionReason": "计划 Stage 1 §11 已设计四种时间预算路径，对照库提供同类结构佐证。",
      "reviewGroup": "G1 现场备战层",
      "recommendedStage": "stage-1",
      "priority": "P1",
      "englishImpact": "none",
      "localeRequirement": "none",
      "dateImpact": "none",
      "reviewDecision": "approved",
      "decidedAt": "2026-08-05",
      "finalAction": "implement",
      "executionReadiness": "ready",
      "localeGate": "pass",
      "localeGateReceipt": "receipt-contract07-2026-08-05",
      "noMatchSearch": "已检查当前库相关模块与全局层的正式问答、证据卡、深挖、课程与学习入口，未发现等价覆盖；无匹配依据：时间预算路径与每步可观察交付物为净新增；场景路径可保留并与之并存。",
      "decisionNotes": "Stage 1 落地：10 分钟/30 分钟/2 小时/系统学习时间预算路径。；localeGate 依据 07 契约（对应模块 deferment 已登记）。",
      "ownerStatus": "resolved",
      "targetStage": "stage-1",
      "targetBatch": "stage-1",
      "recommendedBatch": "stage-1"
    },
    {
      "candidateId": "C-004",
      "conceptKey": "customer-colloquial-aliases",
      "candidateKind": "expression",
      "candidateCategories": [
        "客户问题或客户口语"
      ],
      "sourceOccurrenceIds": [
        "O-P-F3"
      ],
      "summary": "对照库 91 题普遍使用客户口语原话（『谁家最强』『会不会锁死』『是不是翻车』『刹车』『要几张卡』『为什么要付钱』），可作为搜索别名与公开展示短语。",
      "coverageStatus": "partial",
      "currentLocations": [],
      "deltaSummary": "当前库问答是书面正式表达；缺少客户口语别名投影，且部分口语表述映射到多道正式题（如『锁死』映射平台锁定与协议锁定）。",
      "decisionImpactSummary": "客户用自己的话能搜到正确正式问题，提升搜索命中与现场认同感。",
      "dynamicity": "stable",
      "evidenceGate": "pass",
      "riskLevel": "low",
      "ownerType": "global",
      "ownerId": "questions-directory",
      "recommendedAction": "absorb",
      "actionReason": "仅映射搜索与展示，不新增事实；宽泛别名需登记人工复核。",
      "reviewGroup": "G1 现场备战层",
      "recommendedStage": "stage-1",
      "priority": "P1",
      "englishImpact": "none",
      "localeRequirement": "none",
      "dateImpact": "none",
      "reviewDecision": "approved",
      "decidedAt": "2026-08-05",
      "finalAction": "implement",
      "executionReadiness": "ready",
      "localeGate": "pass",
      "localeGateReceipt": "receipt-contract07-2026-08-05",
      "decisionNotes": "Stage 1 落地：客户口语别名（customerPhrases）。；localeGate 依据 07 契约（对应模块 deferment 已登记）。",
      "ownerStatus": "resolved",
      "targetStage": "stage-1",
      "targetBatch": "stage-1",
      "recommendedBatch": "stage-1"
    },
    {
      "candidateId": "C-005",
      "conceptKey": "field-confrontation-framing",
      "candidateKind": "delivery-method",
      "candidateCategories": [
        "售前交付与验收方法",
        "教学结构或可视化表达"
      ],
      "sourceOccurrenceIds": [
        "O-P-A1",
        "O-P-E5"
      ],
      "summary": "把拜访、竞标、评审、汇报与面试视为同一场『对客交锋考试』；每题收题标准为『有源可查、改变一个决定、15–30 秒答得完且带一个可复述判据、不与已有题同句』。",
      "coverageStatus": "net-new",
      "currentLocations": [],
      "deltaSummary": "售前问题收题/组织方法为净新增，属于现场取用层设计输入。",
      "decisionImpactSummary": "现场题集合不膨胀、每题都有决策价值与可复述判据。",
      "dynamicity": "stable",
      "evidenceGate": "pass",
      "riskLevel": "low",
      "ownerType": "global",
      "ownerId": "questions-directory",
      "recommendedAction": "absorb",
      "actionReason": "与 Stage 1 核心题选择硬门（§7.1）互补，可作其方法学参考。",
      "reviewGroup": "G1 现场备战层",
      "recommendedStage": "stage-1",
      "priority": "P2",
      "englishImpact": "none",
      "localeRequirement": "none",
      "dateImpact": "none",
      "reviewDecision": "approved",
      "decidedAt": "2026-08-05",
      "finalAction": "implement",
      "executionReadiness": "ready",
      "localeGate": "pass",
      "localeGateReceipt": "receipt-contract07-2026-08-05",
      "noMatchSearch": "已检查当前库相关模块与全局层的正式问答、证据卡、深挖、课程与学习入口，未发现等价覆盖；无匹配依据：售前问题收题/组织方法为净新增，属于现场取用层设计输入。",
      "decisionNotes": "Stage 1 落地：现场题收录标准与时间预算取用。；localeGate 依据 07 契约（对应模块 deferment 已登记）。",
      "ownerStatus": "resolved",
      "targetStage": "stage-1",
      "targetBatch": "stage-1",
      "recommendedBatch": "stage-1"
    },
    {
      "candidateId": "C-006",
      "conceptKey": "china-platform-selection",
      "candidateKind": "knowledge",
      "candidateCategories": [
        "中国平台、法规和生态研究线索",
        "客户决策框架"
      ],
      "sourceOccurrenceIds": [
        "O-QA-ModelLandscape-11",
        "O-QA-ModelLandscape-13"
      ],
      "summary": "国内模型平台（方舟/百炼/千帆/腾讯等）选型决策面：云绑定、旗舰 vs 组合、私有化底线、生态引力（云资源/数据/投放渠道在哪家，迁移成本偏向哪家），以及『全家桶纳管 vs 自研主轴』两种货架哲学的锁定度差异。",
      "coverageStatus": "net-new",
      "currentLocations": [],
      "deltaSummary": "当前 Model Landscape 有通用 provider/endpoint/region/delivery 元组与退出策略，但缺少国内平台生态引力与货架哲学的稳定决策面；平台名、版本、价格等动态事实须进 Claim。",
      "decisionImpactSummary": "国内客户选平台时给出不依赖排行榜的决策维度，而不是排位推荐。",
      "dynamicity": "dynamic",
      "evidenceGate": "pass",
      "riskLevel": "medium",
      "ownerType": "module",
      "ownerId": "model-landscape",
      "recommendedAction": "research",